{
  "schema_version": "h01-trace-v1",
  "trace_id": "TRACE-H01-COMPLETE",
  "run_id": "RUN-H01-0001",
  "task_id": "TASK-H01-01",
  "ruleset_id": "RULESET-H01-BASE",
  "epoch_id": "EPOCH-H01-SMOKE",
  "fixture_suite_ref": "X-FIXTURE-H01-SUITE",
  "oracle_ref": "X-ORACLE-H01-RULES",
  "adapter_ref": "X-ADAPTER-H01-LOCAL",
  "events": [
    {
      "sequence": 1,
      "state_from": "PENDING",
      "state_to": "RUNNING",
      "event_type": "state-transition",
      "result_code": "OK"
    },
    {
      "sequence": 2,
      "state_from": "RUNNING",
      "state_to": "RUNNING",
      "event_type": "tool",
      "result_code": "OK",
      "tool_result": {
        "tool": "validate-contract",
        "summary": "schema 结构检查通过"
      }
    },
    {
      "sequence": 3,
      "state_from": "RUNNING",
      "state_to": "COMPLETED",
      "event_type": "verification",
      "result_code": "OK",
      "tool_result": {
        "tool": "validate-contract",
        "summary": "全部语义检查通过"
      }
    }
  ],
  "terminal_state": "COMPLETED",
  "status": "completed",
  "scope": "harness-engineering",
  "source_refs": [
    "A-HARNESS-ENGINEERING-PRINCIPLES"
  ]
}
